<jugadas xmlns:xsi="http://www.w3.org/2001/XMLSchema-instance"
         xsi:noNamespaceSchemaLocation="jugadas.xsd">
    <ataque>
        <ataca>
            <jugador>1</jugador>
            <territorio>Buztintxuri</territorio>
        </ataca>
        <defiende>
            <jugador>2</jugador>
            <territorio>Arrosadia</territorio>
        </defiende>
        <tirada>
            <dados>
                <valor>4</valor>
                <valor>3</valor>
                <valor>2</valor>
            </dados>
            <dados>
                <valor>2</valor>
                <valor>1</valor>
            </dados>
        </tirada>
        <territorio>
            <nombre>Buztintxuri</nombre>
            <propietario>1</propietario>
            <ejercitos>4</ejercitos>
        </territorio>
        <territorio>
            <nombre>Arrosadia</nombre>
            <propietario>2</propietario>
            <ejercitos>1</ejercitos>
        </territorio>
    </ataque>
</jugadas>